02-Oct-20,-1976954271,"7/7/2015: In Bayji, Sala ad-Din, Iraq at Railway (Sikak) area, 1 attacker attacked ISF and PMU troops gathered in the railway district in a Confirmed Suicide suicide attack with a Car bomb, killing 4 people (0 civilian, 0 political, and 4 security) and wounding 11 people.  Islamic State claimed the attack.  (Note: Claim status not verified!) The attack was verified as Confirmed Suicide on 8/25/2015 3:26:37 PM. This summary generated: 10/9/2020 3:11:40 PM.",Confirmed Suicide,6,07-07-2015,2015,7,2,10,11,3,4,0,0,0,0,3,4,0,0,1,0,0,5,Car bomb,VBIED,None,259,-1,-99,-99,524,-1,-99,-99,6,21,116,645,2325,-1324771892,Asia,Western Asia,Iraq,Sala ad-Din,Bayji,Railway (Sikak) area,34.93,43.48,ISF and PMU troops gathered in the railway district,3,20,115,Security,Forces,Troop(s),13,111,159,Domestic Government,Iraqi,N/A,18,49,21,N/A,N/A,N/A,1,0,0,1412607573,1585107768,1585107768,Islamic State,N/A,N/A,1585107768,1585107768,1585107768,N/A,N/A,N/A,1585107768,1585107768,1585107768,N/A,N/A,N/A,1,0,1,0
02-Oct-20,-1976845549,"4/3/2013: In Farah, Farah, Afghanistan at Courthouse, 2 attackers attacked Prison holding Taliban fighters in a Confirmed Suicide suicide attack with a Car bomb, killing 46 people (34 civilian, 0 political, and 10 security) and wounding 80 people.  Taliban (IEA) claimed the attack.   The attack was verified as Confirmed Suicide on 3/14/2014 4:46:12 PM. This summary generated: 10/9/2020 3:11:40 PM.",Confirmed Suicide,2,04-03-2013,2013,4,3,80,80,44,46,34,34,0,0,10,10,0,0,1,0,0,5,Car bomb,VBIED,None,333,-1,-99,-99,735,-1,-99,-99,6,13,1,700,828,-1582817909,Asia,Southern Asia,Afghanistan,Farah,Farah,Courthouse,32.36,62.11,Prison holding Taliban fighters,3,22,124,Security,Police,Facility/Building,13,1,159,Domestic Government,Afghan,N/A,18,49,21,N/A,N/A,N/A,1,0,0,1088854842,1585107768,1585107768,Taliban (IEA),N/A,N/A,1585107768,1585107768,1585107768,N/A,N/A,N/A,1585107768,1585107768,1585107768,N/A,N/A,N/A,2,0,0,2
02-Oct-20,-1976521375,"10/17/1985: In Marjayoun, An Nabatiyah, Lebanon at Radio Station, Near Israeli border, 4 attackers attacked Christian-run Voice of Hope Radio Station in a Possible - Conflicting Reports suicide attack with a Belt bomb, killing 2 people (2 civilian, 0 political, and 0 security) and wounding no one.  Lebanese Communist Party and Lebanese National Resistance Front claimed the attack.   The attack was verified as Possible - Conflicting Reports on 3/13/2014 8:21:48 AM. This summary generated: 10/9/2020 3:11:40 PM.",Possible - Conflicting Reports,10,10/17/1985,1985,10,4,0,0,2,2,2,2,0,0,0,0,1,0,0,0,0,3,Belt bomb,PBIED,None,-1,-1,-1,-1,-1,-1,-1,-1,6,21,138,660,5295,1378284162,Asia,Western Asia,Lebanon,An Nabatiyah,Marjayoun,"Radio Station, Near Israeli border",33.36,35.59,Christian-run Voice of Hope Radio Station,1,6,39,Civilian,Media,Facility/Building,42,128,144,N/A,Lebanese,Unknown,3,21,34,Christianity,Unknown (Christianity),Unknown (Christianity),2,0,0,-1413462355,-1240831961,1585107768,Lebanese Communist Party,Lebanese National Resistance Front,N/A,1585107768,1585107768,1585107768,N/A,N/A,N/A,1585107768,1585107768,1585107768,N/A,N/A,N/A,4,0,4,0
02-Oct-20,-1976450116,"10/10/2015: In Ankara, Ankara, Turkey at Train Station, Ankara Central Railway Station, 2 attackers attacked Peace rally of pro-Kurdish HDP supporters againsy heightened PKK vs. Turkish state violence in a Confirmed Suicide suicide attack with a Belt bomb, killing 102 people (102 civilian, 0 political, and 0 security) and wounding 400 people.  No group claimed responsibility, but Islamic State is suspected.  (Note: Claim status not verified!) The attack was verified as Confirmed Suicide on 11/18/2015 10:26:05 AM. This summary generated: 10/9/2020 3:11:40 PM.",Confirmed Suicide,2,10-10-2015,2015,10,6,250,400,102,102,102,102,0,0,0,0,1,0,0,0,0,3,Belt bomb,PBIED,None,13902,-1,-99,-99,14701,-1,-99,-99,6,21,246,640,4259,628885922,Asia,Western Asia,Turkey,Ankara,Ankara,"Train Station, Ankara Central Railway Station",39.933,32.867,Peace rally of pro-Kurdish HDP supporters againsy heightened PKK vs. Turkish state violence,2,13,79,Political,Domestic,Rally,13,235,159,Domestic Government,Turkish,N/A,18,49,21,N/A,N/A,N/A,0,0,1,40934540,1585107768,1585107768,Unknown Group,N/A,N/A,1585107768,1585107768,1585107768,N/A,N/A,N/A,1412607573,1585107768,1585107768,Islamic State,N/A,N/A,2,0,2,0
02-Oct-20,-1974859417,"3/9/2013: In Khost, Khost, Afghanistan at Mangaso area, outskirts of Khost City, 1 attacker attacked Joint NATO-ISAF and Afghan National Police (ANP) patrol in a Confirmed Suicide suicide attack with a Belt bomb, killing 9 people (8 civilian, 0 political, and 1 security) and wounding 2 people.  No group claimed responsibility.  (Note: Claim status not verified!) The attack was verified as Confirmed Suicide on 3/14/2014 4:01:26 PM. This summary generated: 10/9/2020 3:11:40 PM.",Confirmed Suicide,2,03-09-2013,2013,3,6,2,2,9,9,8,8,0,0,1,1,1,0,0,0,0,3,Belt bomb,PBIED,None,-99,-99,-99,-99,-99,-99,-99,-99,6,13,1,700,5296,1796615793,Asia,Southern Asia,Afghanistan,Khost,Khost,"Mangaso area, outskirts of Khost City",33.34,69.9,Joint NATO-ISAF and Afghan National Police (ANP) patrol,3,20,112,Security,Forces,Patrol,7,158,159,North Atlantic Treaty Organization (NATO),Multinational,N/A,18,49,21,N/A,N/A,N/A,0,0,0,40934540,1585107768,1585107768,Unknown Group,N/A,N/A,1585107768,1585107768,1585107768,N/A,N/A,N/A,1585107768,1585107768,1585107768,N/A,N/A,N/A,1,0,0,1
02-Oct-20,-1974741018,"4/30/2004: In Fallujah, Al-Anbar, Iraq at Near a US army camp in Fallujah, 1 attacker attacked US military base in a Confirmed Suicide suicide attack with a Car bomb, killing 2 people (0 civilian, 0 political, and 2 security) and wounding 6 people.  No group claimed responsibility.  (Note: Claim status not verified!) The attack was verified as Confirmed Suicide on 8/7/2012. This summary generated: 10/9/2020 3:11:40 PM.",Confirmed Suicide,3,4/30/2004,2004,4,5,6,6,2,2,0,0,0,0,2,2,0,0,1,0,0,5,Car bomb,VBIED,None,-99,-99,-99,-99,-99,-99,-99,-99,6,21,116,645,2308,-38523887,Asia,Western Asia,Iraq,Al-Anbar,Fallujah,Near a US army camp in Fallujah,33.36,43.77,US military base,3,20,106,Security,Forces,Base,3,5,159,Coalition (Iraq),American,N/A,18,49,21,N/A,N/A,N/A,0,0,0,40934540,1585107768,1585107768,Unknown Group,N/A,N/A,1585107768,1585107768,1585107768,N/A,N/A,N/A,1585107768,1585107768,1585107768,N/A,N/A,N/A,1,0,0,1
02-Oct-20,-1973917725,"11/13/2006: In Baghdad, Baghdad, Iraq at Shaab neighborhood, Northeast Baghdad, 1 attacker attacked Bus transporting Iraqi Shia civilians in a Confirmed Suicide suicide attack with a Belt bomb, killing 10 people (10 civilian, 0 political, and 0 security) and wounding 12 people.  No group claimed responsibility.  (Note: Claim status not verified!) The attack was verified as Confirmed Suicide on 8/7/2012. This summary generated: 10/9/2020 3:11:40 PM.",Confirmed Suicide,2,11/13/2006,2006,11,1,0,12,0,10,0,10,0,0,0,0,1,0,0,0,0,3,Belt bomb,PBIED,None,-99,-99,-99,-99,-99,-99,-99,-99,6,21,116,645,2314,-252679021,Asia,Western Asia,Iraq,Baghdad,Baghdad,"Shaab neighborhood, Northeast Baghdad",33.34,44.4,Bus transporting Iraqi Shia civilians,1,11,65,Civilian,Transportation,Vehicle(s),42,111,144,N/A,Iraqi,Unknown,6,2,23,Islam,Shia,Unknown (Shia),0,0,0,40934540,1585107768,1585107768,Unknown Group,N/A,N/A,1585107768,1585107768,1585107768,N/A,N/A,N/A,1585107768,1585107768,1585107768,N/A,N/A,N/A,1,0,1,0
02-Oct-20,-1973343230,"2/5/2014: In Baghdad, Baghdad, Iraq at Restaurant, Near the Green Zone, 1 attacker attacked Falafel restaurant in a Confirmed Suicide suicide attack with a Belt bomb, killing 5 people (5 civilian, 0 political, and 0 security) and wounding 12 people.  No group claimed responsibility.  (Note: Claim status not verified!) The attack was verified as Confirmed Suicide on 6/4/2014 2:03:07 PM. This summary generated: 10/9/2020 3:11:40 PM.",Confirmed Suicide,2,02-05-2014,2014,2,3,12,12,5,5,5,5,0,0,0,0,1,0,0,0,0,3,Belt bomb,PBIED,None,-99,-99,-99,-99,-99,-99,-99,-99,6,21,116,645,2314,-252679021,Asia,Western Asia,Iraq,Baghdad,Baghdad,"Restaurant, Near the Green Zone",33.34,44.4,Falafel restaurant,1,1,4,Civilian,Commercial,Hotel/Restaurant,42,111,144,N/A,Iraqi,Unknown,14,50,20,Unknown,Unknown,Unknown,0,0,0,40934540,1585107768,1585107768,Unknown Group,N/A,N/A,1585107768,1585107768,1585107768,N/A,N/A,N/A,1585107768,1585107768,1585107768,N/A,N/A,N/A,1,0,1,0
02-Oct-20,-1972709325,"4/27/2014: In Ramadi, Al-Anbar, Iraq at 5 Kilo Area in Al Ramadi, 1 attacker attacked Iraqi Army checkpoint in a Confirmed Suicide suicide attack with a Car bomb, killing 4 people (0 civilian, 0 political, and 4 security) and wounding 5 people.  No group claimed responsibility, but Islamic State of Iraq and Syria is suspected.  (Note: Claim status not verified!) The attack was verified as Confirmed Suicide on 10/12/2018 2:41:04 PM. This summary generated: 10/9/2020 3:11:40 PM.",Confirmed Suicide,3,4/27/2014,2014,4,7,4,5,2,4,0,0,0,0,2,4,0,0,1,0,0,5,Car bomb,VBIED,None,259,-1,-99,-99,524,-1,-99,-99,6,21,116,645,2308,-593069132,Asia,Western Asia,Iraq,Al-Anbar,Ramadi,5 Kilo Area in Al Ramadi,33.434167,43.268611,Iraqi Army checkpoint,3,20,107,Security,Forces,Checkpoint,13,111,159,Domestic Government,Iraqi,N/A,18,49,21,N/A,N/A,N/A,0,0,1,40934540,1585107768,1585107768,Unknown Group,N/A,N/A,1585107768,1585107768,1585107768,N/A,N/A,N/A,-1098742477,1585107768,1585107768,Islamic State of Iraq and Syria,N/A,N/A,1,0,0,1
02-Oct-20,-1972609003,"10/9/2014: In Sanaa, Sana'a (City), Yemen at Tahrir Square, 1 attacker attacked Houthi security checkpoint in a Confirmed Suicide suicide attack with a Belt bomb, killing 47 people (47 civilian, 0 political, and 0 security) and wounding 75 people.  Al-Qaeda in the Arabian Peninsula claimed the attack.  (Note: Claim status not verified!) The attack was verified as Confirmed Suicide on 12/17/2014 11:40:38 AM. This summary generated: 10/9/2020 3:11:40 PM.",Confirmed Suicide,2,10-09-2014,2014,10,4,75,75,47,47,47,47,0,0,0,0,1,0,0,0,0,3,Belt bomb,PBIED,None,-99,-99,-99,-99,-99,-99,-99,-99,6,21,270,679,10010,675790160,Asia,Western Asia,Yemen,Sana'a (City),Sanaa,Tahrir Square,15.354722,44.206667,Houthi security checkpoint,3,24,142,Security,Rival Militant Group,Checkpoint,27,248,144,Yemen Houthi Rebels,Yemeni,Unknown,6,2,7,Islam,Shia,Zaydi,1,0,0,-2102862194,1585107768,1585107768,Al-Qaeda in the Arabian Peninsula,N/A,N/A,1585107768,1585107768,1585107768,N/A,N/A,N/A,1585107768,1585107768,1585107768,N/A,N/A,N/A,1,0,1,0
02-Oct-20,-1972547589,"2/14/2016: In Aden, 'Adan, Yemen at Buraiya district, 1 attacker attacked Training session for recruits in Ras Abbas Army Camp in a Confirmed Suicide suicide attack with a Belt bomb, killing 14 people (0 civilian, 0 political, and 14 security) and wounding 49 people.  Islamic State Yemen claimed the attack.  (Note: Claim status not verified!) The attack was verified as Confirmed Suicide on 8/11/2016 10:01:43 AM. This summary generated: 10/9/2020 3:11:40 PM.",Confirmed Suicide,4,2/14/2016,2016,2,7,49,49,9,14,0,0,0,0,9,14,1,0,0,0,0,3,Belt bomb,PBIED,None,13645,-1,-99,-99,14609,-1,-99,-99,6,21,270,679,4664,1731341689,Asia,Western Asia,Yemen,'Adan,Aden,Buraiya district,12.8,45.033333,Training session for recruits in Ras Abbas Army Camp,3,20,106,Security,Forces,Base,13,248,159,Domestic Government,Yemeni,N/A,18,49,21,N/A,N/A,N/A,1,0,0,1486680168,1585107768,1585107768,Islamic State Yemen,N/A,N/A,1585107768,1585107768,1585107768,N/A,N/A,N/A,1585107768,1585107768,1585107768,N/A,N/A,N/A,1,0,1,0
02-Oct-20,-1972498496,"4/23/2015: In Idlib, Idlib, Syria at near Idlib, 1 attacker attacked Checkpoint into Syrian regime al Qarmeed military base in a Confirmed Suicide suicide attack with a Car bomb, killing no one (0 civilian, 0 political, and 0 security) and wounding no one.  Jabhat an-Nu?rah li-Ahl ash-Sh?m claimed the attack.  (Note: Claim status not verified!) The attack was verified as Confirmed Suicide on 7/19/2016 1:22:08 PM. This summary generated: 10/9/2020 3:11:40 PM.",Confirmed Suicide,3,4/23/2015,2015,4,4,0,0,0,0,0,0,0,0,0,0,0,0,1,0,0,5,Car bomb,VBIED,None,299,-1,-99,-99,11973,-1,-99,-99,6,21,235,652,4022,1988406152,Asia,Western Asia,Syria,Idlib,Idlib,near Idlib,35.933333,36.633333,Checkpoint into Syrian regime al Qarmeed military base,3,20,106,Security,Forces,Base,13,225,159,Domestic Government,Syrian,N/A,18,49,21,N/A,N/A,N/A,1,0,0,1117872197,1585107768,1585107768,Jabhat an-Nu?rah li-Ahl ash-Sh?m,N/A,N/A,1585107768,1585107768,1585107768,N/A,N/A,N/A,1585107768,1585107768,1585107768,N/A,N/A,N/A,1,0,0,1
02-Oct-20,-1971955674,"8/30/2016: In Baghdad, Baghdad, Iraq at Eilam neighborhood, 1 attacker attacked Iraqi, Al-Darwish intersection in al-Sidiya district in a Confirmed Suicide suicide attack with a Belt bomb, killing 3 people (3 civilian, 0 political, and 0 security) and wounding 11 people.  No group claimed responsibility.  (Note: Claim status not verified!) The attack was verified as Confirmed Suicide on 11/18/2016 11:43:58 AM. This summary generated: 10/9/2020 3:11:40 PM.",Confirmed Suicide,2,8/30/2016,2016,8,2,8,11,2,3,2,3,0,0,0,0,1,0,0,0,0,3,Belt bomb,PBIED,None,-99,-99,-99,-99,-99,-99,-99,-99,6,21,116,645,2314,-252679021,Asia,Western Asia,Iraq,Baghdad,Baghdad,Eilam neighborhood,33.34,44.4,"Iraqi, Al-Darwish intersection in al-Sidiya district",1,4,24,Civilian,General,Other,42,111,144,N/A,Iraqi,Unknown,6,2,23,Islam,Shia,Unknown (Shia),0,0,0,40934540,1585107768,1585107768,Unknown Group,N/A,N/A,1585107768,1585107768,1585107768,N/A,N/A,N/A,1585107768,1585107768,1585107768,N/A,N/A,N/A,1,0,1,0
02-Oct-20,-1971595863,"12/26/2013: In Karma, Al-Anbar, Iraq at Headquarters of the 1st Rapid Reaction Brigade in Karmeh district, 1 attacker attacked Military Base in a Possible - Too Few Sources suicide attack with a Belt bomb, killing no one (0 civilian, 0 political, and 0 security) and wounding no one.  No group claimed responsibility.  (Note: Claim status not verified!) The attack was verified as Possible - Too Few Sources on 7/11/2016 8:22:39 AM. This summary generated: 10/9/2020 3:11:40 PM.",Possible - Too Few Sources,1,12/26/2013,2013,12,4,0,0,0,0,0,0,0,0,0,0,1,0,0,0,0,3,Belt bomb,PBIED,None,-99,-99,-99,-99,-99,-99,-99,-99,6,21,116,645,2308,1974369760,Asia,Western Asia,Iraq,Al-Anbar,Karma,Headquarters of the 1st Rapid Reaction Brigade in Karmeh district,33.399793,43.90892,Military Base,3,20,106,Security,Forces,Base,13,111,159,Domestic Government,Iraqi,N/A,18,49,21,N/A,N/A,N/A,0,0,0,40934540,1585107768,1585107768,Unknown Group,N/A,N/A,1585107768,1585107768,1585107768,N/A,N/A,N/A,1585107768,1585107768,1585107768,N/A,N/A,N/A,1,0,0,1
02-Oct-20,-1971553132,"7/19/2017: In Armanaz, Idlib, Syria at Headquarters of Ahrar al Sham in Idlib, 1 attacker attacked Syrian Ahrar al Sham headquarters in a Possible - Too Few Sources suicide attack with a Car bomb, killing 3 people (0 civilian, 0 political, and 3 security) and wounding 16 people.  No group claimed responsibility.  (Note: Claim status not verified!) The attack was verified as Possible - Too Few Sources on 10/18/2017 11:08:42 AM. This summary generated: 10/9/2020 3:11:40 PM.",Possible - Too Few Sources,1,7/19/2017,2017,7,3,16,16,3,3,0,0,0,0,3,3,0,0,1,0,0,5,Car bomb,VBIED,None,-99,-99,-99,-99,-99,-99,-99,-99,6,21,235,652,4022,1508342403,Asia,Western Asia,Syria,Idlib,Armanaz,Headquarters of Ahrar al Sham in Idlib,36.083626,36.503097,Syrian Ahrar al Sham headquarters,3,24,141,Security,Rival Militant Group,Base,25,225,144,Ahrar al-Sham,Syrian,Unknown,6,1,5,Islam,Sunni,Salafism,0,0,0,40934540,1585107768,1585107768,Unknown Group,N/A,N/A,1585107768,1585107768,1585107768,N/A,N/A,N/A,1585107768,1585107768,1585107768,N/A,N/A,N/A,1,0,0,1
02-Oct-20,-1971504169,"3/1/2013: In Mogadishu, Banaadir, Somalia at Restaurant, at Lido beach, 1 attacker attacked Interior and Security Minister Abdikarim Husayn Gulled [survived] in a Confirmed Suicide suicide attack with a Belt bomb, killing 4 people (4 civilian, 0 political, and 0 security) and wounding 7 people.  No group claimed responsibility.  (Note: Claim status not verified!) The attack was verified as Confirmed Suicide on 4/25/2014 5:12:00 PM. This summary generated: 10/9/2020 3:11:40 PM.",Confirmed Suicide,3,03-01-2013,2013,3,5,6,7,1,4,1,4,0,0,0,0,1,0,0,0,0,3,Belt bomb,PBIED,None,-99,-99,-99,-99,-99,-99,-99,-99,3,6,223,520,3864,-880438404,Africa,Eastern Africa,Somalia,Banaadir,Mogadishu,"Restaurant, at Lido beach",2.03711,45.34375,Interior and Security Minister Abdikarim Husayn Gulled [survived],2,13,74,Political,Domestic,Leader(s),13,214,159,Domestic Government,Somali,N/A,18,49,21,N/A,N/A,N/A,0,0,0,40934540,1585107768,1585107768,Unknown Group,N/A,N/A,1585107768,1585107768,1585107768,N/A,N/A,N/A,1585107768,1585107768,1585107768,N/A,N/A,N/A,1,0,0,1
02-Oct-20,-1971386551,"5/2/2015: In Karma, Al-Anbar, Iraq at Train station, 1 attacker attacked Military headquarters of the Iraqi Army and the Popular Mobilization Units in a Confirmed Suicide suicide attack with a Truck bomb, killing 12 people (0 civilian, 0 political, and 12 security) and wounding 24 people.  No group claimed responsibility, but Islamic State is suspected.  (Note: Claim status not verified!) The attack was verified as Confirmed Suicide on 7/6/2015 9:42:04 AM. This summary generated: 10/9/2020 3:11:40 PM.",Confirmed Suicide,3,05-02-2015,2015,5,6,8,24,6,12,0,0,0,0,6,12,0,1,0,0,0,4,Truck bomb,VBIED,None,259,-1,-99,-99,524,-1,-99,-99,6,21,116,645,2308,1974369760,Asia,Western Asia,Iraq,Al-Anbar,Karma,Train station,33.399793,43.90892,Military headquarters of the Iraqi Army and the Popular Mobilization Units,3,20,109,Security,Forces,Facility/Building,13,111,159,Domestic Government,Iraqi,N/A,18,49,21,N/A,N/A,N/A,0,0,1,40934540,1585107768,1585107768,Unknown Group,N/A,N/A,1585107768,1585107768,1585107768,N/A,N/A,N/A,1412607573,1585107768,1585107768,Islamic State,N/A,N/A,1,0,1,0
02-Oct-20,-1968592226,"10/17/2013: In Baghdad, Baghdad, Iraq at Iraqi Police checkpoint, 1 attacker attacked Iraqi Police in a Confirmed Suicide suicide attack with a Car bomb, killing 5 people (2 civilian, 0 political, and 3 security) and wounding 9 people.  No group claimed responsibility.  (Note: Claim status not verified!) The attack was verified as Confirmed Suicide on 3/13/2014 1:31:04 PM. This summary generated: 10/9/2020 3:11:40 PM.",Confirmed Suicide,3,10/17/2013,2013,10,4,9,9,5,5,2,2,0,0,3,3,0,0,1,0,0,5,Car bomb,VBIED,None,-99,-99,-99,-99,-99,-99,-99,-99,6,21,116,645,2314,-252679021,Asia,Western Asia,Iraq,Baghdad,Baghdad,Iraqi Police checkpoint,33.34,44.4,Iraqi Police,3,22,122,Security,Police,Checkpoint,13,111,159,Domestic Government,Iraqi,N/A,18,49,21,N/A,N/A,N/A,0,0,0,40934540,1585107768,1585107768,Unknown Group,N/A,N/A,1585107768,1585107768,1585107768,N/A,N/A,N/A,1585107768,1585107768,1585107768,N/A,N/A,N/A,1,0,0,1
02-Oct-20,-1968381838,"9/17/2001: In Argun, Chechnya, Russia at Home of Movsar Timerbayev, 1 attacker attacked Movsar Timerbayev, Administrative Head of Argun in a Confirmed Suicide suicide attack with a Car bomb, killing 1 person (0 civilian, 0 political, and 1 security) and wounding no one.  Chechen Republic of Ichkeria claimed the attack.   The attack was verified as Confirmed Suicide on 2/7/2014 7:15:57 AM. This summary generated: 10/9/2020 3:11:40 PM.",Confirmed Suicide,2,9/17/2001,2001,9,1,0,0,1,1,0,0,0,0,1,1,0,0,1,0,0,5,Car bomb,VBIED,None,401,-1,-99,-99,852,-1,-99,-99,7,22,203,365,3545,-1010069701,Europe,Eastern Europe,Russia,Chechnya,Argun,Home of Movsar Timerbayev,43.28,45.86,"Movsar Timerbayev, Administrative Head of Argun",2,13,74,Political,Domestic,Leader(s),13,192,159,Domestic Government,Russian,N/A,18,49,21,N/A,N/A,N/A,1,0,0,-1331733387,1585107768,1585107768,Chechen Republic of Ichkeria,N/A,N/A,1585107768,1585107768,1585107768,N/A,N/A,N/A,1585107768,1585107768,1585107768,N/A,N/A,N/A,1,0,1,0
02-Oct-20,-1967602645,"1/28/2005: In Baghdad, Baghdad, Iraq at Doura neighborhood, near power station, 1 attacker attacked Iraqi Police checkpoint in a Confirmed Suicide suicide attack with a Car bomb, killing 6 people (0 civilian, 0 political, and 6 security) and wounding 4 people.  No group claimed responsibility.  (Note: Claim status not verified!) The attack was verified as Confirmed Suicide on 3/10/2014 1:32:27 PM. This summary generated: 10/9/2020 3:11:40 PM.",Confirmed Suicide,3,1/28/2005,2005,1,5,4,4,4,6,0,0,0,0,4,6,0,0,1,0,0,5,Car bomb,VBIED,None,-99,-99,-99,-99,-99,-99,-99,-99,6,21,116,645,2314,-252679021,Asia,Western Asia,Iraq,Baghdad,Baghdad,"Doura neighborhood, near power station",33.34,44.4,Iraqi Police checkpoint,3,22,122,Security,Police,Checkpoint,13,111,159,Domestic Government,Iraqi,N/A,18,49,21,N/A,N/A,N/A,0,0,0,40934540,1585107768,1585107768,Unknown Group,N/A,N/A,1585107768,1585107768,1585107768,N/A,N/A,N/A,1585107768,1585107768,1585107768,N/A,N/A,N/A,1,0,1,0
02-Oct-20,-1967501429,"10/17/2004: In Mosul, Ninawa, Iraq at Bridge, Iraqi bridge in Mosul, 1 attacker attacked Iraqi civilians in a Confirmed Suicide suicide attack with a Car bomb, killing 5 people (5 civilian, 0 political, and 0 security) and wounding 15 people.  No group claimed responsibility.  (Note: Claim status not verified!) The attack was verified as Confirmed Suicide on 4/23/2018 12:15:17 PM. This summary generated: 10/9/2020 3:11:40 PM.",Confirmed Suicide,2,10/17/2004,2004,10,7,15,15,5,5,5,5,0,0,0,0,0,0,1,0,0,5,Car bomb,VBIED,None,-99,-99,-99,-99,-99,-99,-99,-99,6,21,116,645,2322,-1138982372,Asia,Western Asia,Iraq,Ninawa,Mosul,"Bridge, Iraqi bridge in Mosul",36.33,43.11,Iraqi civilians,1,5,31,Civilian,Infrastructure,Bridge,42,111,144,N/A,Iraqi,Unknown,14,50,20,Unknown,Unknown,Unknown,0,0,0,40934540,1585107768,1585107768,Unknown Group,N/A,N/A,1585107768,1585107768,1585107768,N/A,N/A,N/A,1585107768,1585107768,1585107768,N/A,N/A,N/A,1,0,0,1
02-Oct-20,-1965981106,"7/12/2007: In Miramshah, F.A.T.A., Pakistan at Office of the Political Agent (PA), top representative of the federal government in tribal areas, 1 attacker attacked Pakistani government workers in a Confirmed Suicide suicide attack with a Belt bomb, killing 3 people (0 civilian, 3 political, and 0 security) and wounding 3 people.  No group claimed responsibility.  (Note: Claim status not verified!) The attack was verified as Confirmed Suicide on 7/27/2012. This summary generated: 10/9/2020 3:11:40 PM.",Confirmed Suicide,4,07-12-2007,2007,7,4,2,3,2,3,0,0,2,3,0,0,1,0,0,0,0,3,Belt bomb,PBIED,None,-99,-99,-99,-99,-99,-99,-99,-99,6,13,187,770,3216,1493826739,Asia,Southern Asia,Pakistan,F.A.T.A.,Miramshah,"Office of the Political Agent (PA), top representative of the federal government in tribal areas",33,70.06,Pakistani government workers,2,13,72,Political,Domestic,Facility/Building,13,177,159,Domestic Government,Pakistani,N/A,18,49,21,N/A,N/A,N/A,0,0,0,40934540,1585107768,1585107768,Unknown Group,N/A,N/A,1585107768,1585107768,1585107768,N/A,N/A,N/A,1585107768,1585107768,1585107768,N/A,N/A,N/A,1,0,1,0
02-Oct-20,-1965262851,"2/18/2010: In Ramadi, Al-Anbar, Iraq at outside the gate of the main government compound, 1 attacker attacked Iraqi Police checkpoint in a Confirmed Suicide suicide attack with a Car bomb, killing 13 people (1 civilian, 0 political, and 4 security) and wounding 26 people.  No group claimed responsibility.  (Note: Claim status not verified!) The attack was verified as Confirmed Suicide on 8/7/2012. This summary generated: 10/9/2020 3:11:40 PM.",Confirmed Suicide,3,2/18/2010,2010,2,4,15,26,10,13,0,1,0,0,4,4,0,0,1,0,0,5,Car bomb,VBIED,None,-99,-99,-99,-99,-99,-99,-99,-99,6,21,116,645,2308,-593069132,Asia,Western Asia,Iraq,Al-Anbar,Ramadi,outside the gate of the main government compound,33.434167,43.268611,Iraqi Police checkpoint,3,22,122,Security,Police,Checkpoint,13,111,159,Domestic Government,Iraqi,N/A,18,49,21,N/A,N/A,N/A,0,0,0,40934540,1585107768,1585107768,Unknown Group,N/A,N/A,1585107768,1585107768,1585107768,N/A,N/A,N/A,1585107768,1585107768,1585107768,N/A,N/A,N/A,1,0,1,0
02-Oct-20,-1964855860,"1/25/2017: In Tikrit, Sala ad-Din, Iraq at Suwayda Village near Tel Ksaiba, 2 attackers attacked Iraqi Army and Popular Mobilization soldiers in a Possible - Conflicting Reports suicide attack with a Car bomb, killing 4 people (0 civilian, 0 political, and 2 security) and wounding 4 people.  Islamic State claimed the attack.  (Note: Claim status not verified!) The attack was verified as Possible - Conflicting Reports on 4/19/2017 10:48:01 AM. This summary generated: 10/9/2020 3:11:40 PM.",Possible - Conflicting Reports,4,1/25/2017,2017,1,3,2,4,2,4,0,0,0,0,2,2,0,0,1,0,0,5,Car bomb,VBIED,None,259,-1,-99,-99,524,-1,-99,-99,6,21,116,645,2325,207828367,Asia,Western Asia,Iraq,Sala ad-Din,Tikrit,Suwayda Village near Tel Ksaiba,34.6,43.67,Iraqi Army and Popular Mobilization soldiers,3,20,115,Security,Forces,Troop(s),13,111,159,Domestic Government,Iraqi,N/A,18,49,21,N/A,N/A,N/A,1,0,0,1412607573,1585107768,1585107768,Islamic State,N/A,N/A,1585107768,1585107768,1585107768,N/A,N/A,N/A,1585107768,1585107768,1585107768,N/A,N/A,N/A,2,0,1,1
