02-Oct-20,-2068136155,"6/24/2004: In Baghdad, Baghdad, Iraq at Iraqi National Guard checkpoint, 1 attacker attacked Iraqi National Guard in a Confirmed Suicide suicide attack with a Belt bomb, killing 7 people (3 civilian, 0 political, and 4 security) and wounding 3 people.  Jaish Ansar al-Sunnah claimed the attack.  (Note: Claim status not verified!) The attack was verified as Confirmed Suicide on 8/7/2012 8:29:26 PM. This summary generated: 10/9/2020 3:11:40 PM.",Confirmed Suicide,5,6/24/2004,2004,6,4,2,3,4,7,0,3,0,0,4,4,1,0,0,0,0,3,Belt bomb,PBIED,None,259,-1,-99,-99,524,-1,-99,-99,6,21,116,645,2314,-252679021,Asia,Western Asia,Iraq,Baghdad,Baghdad,Iraqi National Guard checkpoint,33.34,44.4,Iraqi National Guard,3,20,107,Security,Forces,Checkpoint,13,111,159,Domestic Government,Iraqi,N/A,18,49,21,N/A,N/A,N/A,1,0,0,-998283981,1585107768,1585107768,Jaish Ansar al-Sunnah,N/A,N/A,1585107768,1585107768,1585107768,N/A,N/A,N/A,1585107768,1585107768,1585107768,N/A,N/A,N/A,1,0,1,0
02-Oct-20,-2067001384,"9/28/2017: In Suwayyan, Hasaka (Al Haksa), Syria at Building complex near town crossroads, 1 attacker attacked Syrian Democratic Forces Facility in a Possible - Too Few Sources suicide attack with a Car bomb, killing no one (0 civilian, 0 political, and 0 security) and wounding no one.  No group claimed responsibility.  (Note: Claim status not verified!) The attack was verified as Possible - Too Few Sources on 11/8/2017 10:14:11 AM. This summary generated: 10/9/2020 3:11:40 PM.",Possible - Too Few Sources,1,9/28/2017,2017,9,4,0,0,0,0,0,0,0,0,0,0,0,0,1,0,0,5,Car bomb,VBIED,None,-99,-99,-99,-99,-99,-99,-99,-99,6,21,235,652,4011,1088936390,Asia,Western Asia,Syria,Hasaka (Al Haksa),Suwayyan,Building complex near town crossroads,36.165,40.49083,Syrian Democratic Forces Facility,3,38,218,Security,Separatist Militia,Facility/Building,17,225,144,Syrian Democratic Forces,Syrian,Unknown,14,50,20,Unknown,Unknown,Unknown,0,0,0,40934540,1585107768,1585107768,Unknown Group,N/A,N/A,1585107768,1585107768,1585107768,N/A,N/A,N/A,1585107768,1585107768,1585107768,N/A,N/A,N/A,1,0,0,1
02-Oct-20,-2066570533,"8/10/2006: In Najaf, An Najaf, Iraq at Shrine, Near Imam Ali Mausoleum, 1 attacker attacked Iraqi Shia Shrine in a Confirmed Suicide suicide attack with a Belt bomb, killing 35 people (30 civilian, 0 political, and 5 security) and wounding 122 people.  Soldiers of the Prophet's Companions Group claimed the attack.   The attack was verified as Confirmed Suicide on 8/10/2012 12:15:18 PM. This summary generated: 10/9/2020 3:11:40 PM.",Confirmed Suicide,2,08-10-2006,2006,8,4,108,122,33,35,30,30,0,0,3,5,1,0,0,0,0,3,Belt bomb,PBIED,None,-1,-1,538,-1,-1,-1,1005,-1,6,21,116,645,2324,-562913008,Asia,Western Asia,Iraq,An Najaf,Najaf,"Shrine, Near Imam Ali Mausoleum",31.99,44.33,Iraqi Shia Shrine,1,8,44,Civilian,Religious,Facility/Building,42,111,144,N/A,Iraqi,Unknown,6,2,23,Islam,Shia,Unknown (Shia),1,0,0,-1553067539,1585107768,1585107768,Soldiers of the Prophet's Companions Group,N/A,N/A,1585107768,1585107768,1585107768,N/A,N/A,N/A,1585107768,1585107768,1585107768,N/A,N/A,N/A,1,0,1,0
02-Oct-20,-2065827889,"4/7/2006: In Baghdad, Baghdad, Iraq at Mosque, al-Ataifya district, 3 attackers attacked Shia Buratha Mosque in a Confirmed Suicide suicide attack with a Belt bomb, killing 85 people (85 civilian, 0 political, and 0 security) and wounding 164 people.  No group claimed responsibility.  (Note: Claim status not verified!) The attack was verified as Confirmed Suicide on 4/25/2014 4:36:33 PM. This summary generated: 10/9/2020 3:11:40 PM.",Confirmed Suicide,3,04-07-2006,2006,4,5,130,164,40,85,40,85,0,0,0,0,1,0,0,0,0,3,Belt bomb,PBIED,None,-99,-99,-99,-99,-99,-99,-99,-99,6,21,116,645,2314,-252679021,Asia,Western Asia,Iraq,Baghdad,Baghdad,"Mosque, al-Ataifya district",33.34,44.4,Shia Buratha Mosque,1,8,44,Civilian,Religious,Facility/Building,42,111,144,N/A,Iraqi,Unknown,6,2,23,Islam,Shia,Unknown (Shia),0,0,0,40934540,1585107768,1585107768,Unknown Group,N/A,N/A,1585107768,1585107768,1585107768,N/A,N/A,N/A,1585107768,1585107768,1585107768,N/A,N/A,N/A,3,0,0,3
02-Oct-20,-2065603619,"1/22/2008: In Lashkar Gah, Hilmand, Afghanistan at Unknown, 1 attacker attacked Bomber's suicide vest detonated accidentally en route to target in a Possible - Conflicting Reports suicide attack with a Belt bomb, killing no one (0 civilian, 0 political, and 0 security) and wounding no one.  No group claimed responsibility.  (Note: Claim status not verified!) The attack was verified as Possible - Conflicting Reports on 7/8/2014 12:18:57 PM. This summary generated: 10/9/2020 3:11:40 PM.",Possible - Conflicting Reports,3,1/22/2008,2008,1,2,0,0,0,0,0,0,0,0,0,0,1,0,0,0,0,3,Belt bomb,PBIED,None,-99,-99,-99,-99,-99,-99,-99,-99,6,13,1,700,832,-347043585,Asia,Southern Asia,Afghanistan,Hilmand,Lashkar Gah,Unknown,31.59,64.37,Bomber's suicide vest detonated accidentally en route to target,1,4,27,Civilian,General,Residential Area,42,242,144,N/A,Unknown,Unknown,14,50,20,Unknown,Unknown,Unknown,0,0,0,40934540,1585107768,1585107768,Unknown Group,N/A,N/A,1585107768,1585107768,1585107768,N/A,N/A,N/A,1585107768,1585107768,1585107768,N/A,N/A,N/A,1,0,1,0
02-Oct-20,-2065170597,"10/12/2008: In Mosul, Ninawa, Iraq at Western Mosul, 1 attacker attacked Iraqi Police patrol in a Confirmed Suicide suicide attack with a Car bomb, killing 5 people (5 civilian, 0 political, and 0 security) and wounding 25 people.  No group claimed responsibility.  (Note: Claim status not verified!) The attack was verified as Confirmed Suicide on 4/18/2014 10:05:22 AM. This summary generated: 10/9/2020 3:11:40 PM.",Confirmed Suicide,2,10-12-2008,2008,10,7,25,25,5,5,5,5,0,0,0,0,0,0,1,0,0,5,Car bomb,VBIED,None,-99,-99,-99,-99,-99,-99,-99,-99,6,21,116,645,2322,-1138982372,Asia,Western Asia,Iraq,Ninawa,Mosul,Western Mosul,36.33,43.11,Iraqi Police patrol,3,22,128,Security,Police,Patrol,13,111,159,Domestic Government,Iraqi,N/A,18,49,21,N/A,N/A,N/A,0,0,0,40934540,1585107768,1585107768,Unknown Group,N/A,N/A,1585107768,1585107768,1585107768,N/A,N/A,N/A,1585107768,1585107768,1585107768,N/A,N/A,N/A,1,0,0,1
02-Oct-20,-2064661623,"12/27/2013: In Jalpaiguri, West Bengal, India at Bridge, Darjeeling tea district, 1 attacker attacked Barjrapra bridge in a Confirmed Suicide suicide attack with a Motorcycle bomb, killing 5 people (5 civilian, 0 political, and 0 security) and wounding 11 people.  No group claimed responsibility, but Kamtapur Liberation Organization is suspected.  Kamtapur Liberation Organization denied responsibility for the attack. The attack was verified as Confirmed Suicide on 3/21/2014 11:38:18 AM. This summary generated: 10/9/2020 3:11:40 PM.",Confirmed Suicide,2,12/27/2013,2013,12,5,11,11,5,5,5,5,0,0,0,0,0,0,0,1,0,6,Motorcycle bomb,VBIED,None,-1,-1,-1,-1,-1,-1,-1,-1,6,13,113,750,2194,686840031,Asia,Southern Asia,India,West Bengal,Jalpaiguri,"Bridge, Darjeeling tea district",26.52,88.73,Barjrapra bridge,1,5,38,Civilian,Infrastructure,Transportation,42,108,144,N/A,Indian,Unknown,14,50,20,Unknown,Unknown,Unknown,0,1,1,40934540,1585107768,1585107768,Unknown Group,N/A,N/A,1591445029,1585107768,1585107768,Kamtapur Liberation Organization,N/A,N/A,1591445029,1585107768,1585107768,Kamtapur Liberation Organization,N/A,N/A,1,0,0,1
02-Oct-20,-2062258354,"10/20/2014: In Baghdad, Baghdad, Iraq at Mosque, Sinak area of central Baghdad, 1 attacker attacked Husseiniyat al-Khayrat Shia Mosque in a Confirmed Suicide suicide attack with a Belt bomb, killing 11 people (11 civilian, 0 political, and 0 security) and wounding 26 people.  No group claimed responsibility.  (Note: Claim status not verified!) The attack was verified as Confirmed Suicide on 12/16/2014 2:53:30 PM. This summary generated: 10/9/2020 3:11:40 PM.",Confirmed Suicide,2,10/20/2014,2014,10,1,12,26,4,11,4,11,0,0,0,0,1,0,0,0,0,3,Belt bomb,PBIED,None,-99,-99,-99,-99,-99,-99,-99,-99,6,21,116,645,2314,-252679021,Asia,Western Asia,Iraq,Baghdad,Baghdad,"Mosque, Sinak area of central Baghdad",33.34,44.4,Husseiniyat al-Khayrat Shia Mosque,1,8,44,Civilian,Religious,Facility/Building,42,111,144,N/A,Iraqi,Unknown,6,2,23,Islam,Shia,Unknown (Shia),0,0,0,40934540,1585107768,1585107768,Unknown Group,N/A,N/A,1585107768,1585107768,1585107768,N/A,N/A,N/A,1585107768,1585107768,1585107768,N/A,N/A,N/A,1,0,0,1
02-Oct-20,-2059016497,"9/21/2015: In Al Hasakah, Hasaka (Al Haksa), Syria at Southern entrance to Al Hasakah, 1 attacker attacked Kurdish YPG roadblock in a Confirmed Suicide suicide attack with a Car bomb, killing 2 people (0 civilian, 0 political, and 2 security) and wounding 2 people.  No group claimed responsibility.  (Note: Claim status not verified!) The attack was verified as Confirmed Suicide on 11/16/2015 7:06:39 PM. This summary generated: 10/9/2020 3:11:40 PM.",Confirmed Suicide,2,9/21/2015,2015,9,1,2,2,2,2,0,0,0,0,2,2,0,0,1,0,0,5,Car bomb,VBIED,None,-99,-99,-99,-99,-99,-99,-99,-99,6,21,235,652,4011,-1161463691,Asia,Western Asia,Syria,Hasaka (Al Haksa),Al Hasakah,Southern entrance to Al Hasakah,36.483333,40.75,Kurdish YPG roadblock,3,38,216,Security,Separatist Militia,Checkpoint,26,242,80,People's Protection Units (Kurdish YPG),Unknown,Kurd,14,50,20,Unknown,Unknown,Unknown,0,0,0,40934540,1585107768,1585107768,Unknown Group,N/A,N/A,1585107768,1585107768,1585107768,N/A,N/A,N/A,1585107768,1585107768,1585107768,N/A,N/A,N/A,1,0,0,1
02-Oct-20,-2058655937,"3/25/2014: In Asadabad, Kunar, Afghanistan at Kabul Bank, 2 attackers attacked Afghan Local Police (ALP) collecting their pay in a Confirmed Suicide suicide attack with a Belt bomb, killing 5 people (0 civilian, 0 political, and 5 security) and wounding 16 people.  Taliban (IEA) claimed the attack.  (Note: Claim status not verified!) The attack was verified as Confirmed Suicide on 5/19/2015 3:17:29 PM. This summary generated: 10/9/2020 3:11:40 PM.",Confirmed Suicide,3,3/25/2014,2014,3,2,2,16,2,5,0,0,0,0,2,5,1,0,0,0,0,3,Belt bomb,PBIED,None,333,-1,-99,-99,735,-1,-99,-99,6,13,1,700,837,-1899248889,Asia,Southern Asia,Afghanistan,Kunar,Asadabad,Kabul Bank,34.873563,71.151215,Afghan Local Police (ALP) collecting their pay,3,22,131,Security,Police,Troop(s),13,1,159,Domestic Government,Afghan,N/A,18,49,21,N/A,N/A,N/A,1,0,0,1088854842,1585107768,1585107768,Taliban (IEA),N/A,N/A,1585107768,1585107768,1585107768,N/A,N/A,N/A,1585107768,1585107768,1585107768,N/A,N/A,N/A,2,0,0,2
02-Oct-20,-2058531344,"5/3/2014: In Mukalla, Hadramawt, Yemen at Residential neighborhood of Mukalla, 1 attacker attacked Yemeni Security Intelligence Post in a Confirmed Suicide suicide attack with a Car bomb, killing 6 people (0 civilian, 0 political, and 2 security) and wounding 20 people.  No group claimed responsibility.  (Note: Claim status not verified!) The attack was verified as Confirmed Suicide on 7/24/2014 2:04:24 PM. This summary generated: 10/9/2020 3:11:40 PM.",Confirmed Suicide,3,05-03-2014,2014,5,6,2,20,2,6,0,0,0,0,0,2,0,0,1,0,0,5,Car bomb,VBIED,None,-99,-99,-99,-99,-99,-99,-99,-99,6,21,270,679,4666,-620727432,Asia,Western Asia,Yemen,Hadramawt,Mukalla,Residential neighborhood of Mukalla,14.533333,49.133333,Yemeni Security Intelligence Post,3,20,109,Security,Forces,Facility/Building,13,248,159,Domestic Government,Yemeni,N/A,18,49,21,N/A,N/A,N/A,0,0,0,40934540,1585107768,1585107768,Unknown Group,N/A,N/A,1585107768,1585107768,1585107768,N/A,N/A,N/A,1585107768,1585107768,1585107768,N/A,N/A,N/A,1,0,0,1
02-Oct-20,-2057948864,"1/26/2007: In Lashkar Gah, Hilmand, Afghanistan at Outside the Alternative Livelihoods offices, 1 attacker attacked Offices of the Alternative Livelihoods Programme (United Nations) in a Confirmed Suicide suicide attack with a Belt bomb, killing no one (0 civilian, 0 political, and 0 security) and wounding 3 people.  No group claimed responsibility.  (Note: Claim status not verified!) The attack was verified as Confirmed Suicide on 4/1/2014 9:54:14 PM. This summary generated: 10/9/2020 3:11:40 PM.",Confirmed Suicide,3,1/26/2007,2007,1,5,3,3,0,0,0,0,0,0,0,0,1,0,0,0,0,3,Belt bomb,PBIED,None,-99,-99,-99,-99,-99,-99,-99,-99,6,13,1,700,832,-347043585,Asia,Southern Asia,Afghanistan,Hilmand,Lashkar Gah,Outside the Alternative Livelihoods offices,31.59,64.37,Offices of the Alternative Livelihoods Programme (United Nations),2,14,83,Political,Foreign,Facility/Building,9,5,144,United Nations (UN),American,Unknown,14,50,20,Unknown,Unknown,Unknown,0,0,0,40934540,1585107768,1585107768,Unknown Group,N/A,N/A,1585107768,1585107768,1585107768,N/A,N/A,N/A,1585107768,1585107768,1585107768,N/A,N/A,N/A,1,0,1,0
02-Oct-20,-2057301245,"7/10/2005: In Ramadi, Al-Anbar, Iraq at Military checkpoint, 1 attacker attacked Coalition military checkpoint in a Confirmed Suicide suicide attack with a Belt bomb, killing no one (0 civilian, 0 political, and 0 security) and wounding no one.  No group claimed responsibility.  (Note: Claim status not verified!) The attack was verified as Confirmed Suicide on 2/10/2015 3:08:53 PM. This summary generated: 10/9/2020 3:11:40 PM.",Confirmed Suicide,2,07-10-2005,2005,7,7,0,0,0,0,0,0,0,0,0,0,1,0,0,0,0,3,Belt bomb,PBIED,None,-99,-99,-99,-99,-99,-99,-99,-99,6,21,116,645,2308,-593069132,Asia,Western Asia,Iraq,Al-Anbar,Ramadi,Military checkpoint,33.434167,43.268611,Coalition military checkpoint,3,20,107,Security,Forces,Checkpoint,3,158,144,Coalition (Iraq),Multinational,Unknown,14,50,20,Unknown,Unknown,Unknown,0,0,0,40934540,1585107768,1585107768,Unknown Group,N/A,N/A,1585107768,1585107768,1585107768,N/A,N/A,N/A,1585107768,1585107768,1585107768,N/A,N/A,N/A,1,0,0,1
02-Oct-20,-2056898343,"3/12/1985: In Jezzine, South Lebanon, Lebanon at South of Jezzine, near northwestern border between Lebanon and Israel, 1 attacker attacked Israeli Defense Forces (IDF) military convoy in a Confirmed Suicide suicide attack with a Car bomb, killing 3 people (0 civilian, 0 political, and 3 security) and wounding 1 person.  Amal and Lebanese National Resistance Front claimed the attack.   The attack was verified as Confirmed Suicide on 3/11/2014 8:07:31 PM. This summary generated: 10/9/2020 3:11:40 PM.",Confirmed Suicide,5,03-12-1985,1985,3,2,1,1,0,3,0,0,0,0,0,3,0,0,1,0,0,5,Car bomb,VBIED,None,260,-1,-99,-99,529,-1,-99,-99,6,21,138,660,2482,1262634394,Asia,Western Asia,Lebanon,South Lebanon,Jezzine,"South of Jezzine, near northwestern border between Lebanon and Israel",33.53,35.58,Israeli Defense Forces (IDF) military convoy,3,20,108,Security,Forces,Convoy,14,113,159,Foreign Government,Israeli,N/A,18,49,21,N/A,N/A,N/A,2,0,0,-1240831961,-534292260,1585107768,Lebanese National Resistance Front,Amal,N/A,1585107768,1585107768,1585107768,N/A,N/A,N/A,1585107768,1585107768,1585107768,N/A,N/A,N/A,1,0,1,0
02-Oct-20,-2055280517,"7/16/2011: In Bordj Menaiel, Boumerdes, Algeria at Outside local police headquarters, 1 attacker attacked Algerian National Police (ASN) police station in a Confirmed Suicide suicide attack with a Belt bomb, killing 2 people (0 civilian, 0 political, and 2 security) and wounding no one.  No group claimed responsibility, but Al-Qaeda in the Land of the Islamic Maghreb is suspected.  (Note: Claim status not verified!) The attack was verified as Confirmed Suicide on 3/28/2014 1:53:27 PM. This summary generated: 10/9/2020 3:11:40 PM.",Confirmed Suicide,3,7/16/2011,2011,7,6,0,0,2,2,0,0,0,0,2,2,1,0,0,0,0,3,Belt bomb,PBIED,None,386,-1,-99,-99,830,-1,-99,-99,3,7,3,615,887,1822658337,Africa,Northern Africa,Algeria,Boumerdes,Bordj Menaiel,Outside local police headquarters,36.74,3.72,Algerian National Police (ASN) police station,3,22,124,Security,Police,Facility/Building,13,4,159,Domestic Government,Algerian,N/A,18,49,21,N/A,N/A,N/A,0,0,1,40934540,1585107768,1585107768,Unknown Group,N/A,N/A,1585107768,1585107768,1585107768,N/A,N/A,N/A,1261808859,1585107768,1585107768,Al-Qaeda in the Land of the Islamic Maghreb,N/A,N/A,1,0,0,1
02-Oct-20,-2055260179,"3/16/2007: In Albu Issa, Al-Anbar, Iraq at Near the tribal leader's home, 1 attacker attacked Sahwa/Awakening Council leader [survived] in a Confirmed Suicide suicide attack with Chemical weapon dispersed via a Truck bomb, killing 2 people (2 civilian, 0 political, and 0 security) and wounding 115 people.  No group claimed responsibility.  (Note: Claim status not verified!) The attack was verified as Confirmed Suicide on 4/9/2014 11:11:42 AM. This summary generated: 10/9/2020 3:11:40 PM.",Confirmed Suicide,5,3/16/2007,2007,3,5,115,115,2,2,2,2,0,0,0,0,0,1,0,0,0,4,Truck bomb,VBIED,Chemical,-99,-99,-99,-99,-99,-99,-99,-99,6,21,116,645,2308,1565997035,Asia,Western Asia,Iraq,Al-Anbar,Albu Issa,Near the tribal leader's home,33.16,43.86,Sahwa/Awakening Council leader [survived],3,33,209,Security,Government Organized Militia,Leader(s),2,111,13,Awakening,Iraqi,Arab,6,1,22,Islam,Sunni,Unknown (Sunni),0,0,0,40934540,1585107768,1585107768,Unknown Group,N/A,N/A,1585107768,1585107768,1585107768,N/A,N/A,N/A,1585107768,1585107768,1585107768,N/A,N/A,N/A,1,0,1,0
02-Oct-20,-2054371336,"7/1/2009: In Peshawar, Khyber-Pakhtunkhwa, Pakistan at Mashogagar Area, 1 attacker attacked Pakistani Police patrol in a Confirmed Suicide suicide attack with a Belt bomb, killing no one (0 civilian, 0 political, and 0 security) and wounding no one.  No group claimed responsibility.  (Note: Claim status not verified!) The attack was verified as Confirmed Suicide on 4/25/2014 3:25:13 PM. This summary generated: 10/9/2020 3:11:40 PM.",Confirmed Suicide,2,07-01-2009,2009,7,3,0,0,0,0,0,0,0,0,0,0,1,0,0,0,0,3,Belt bomb,PBIED,None,-99,-99,-99,-99,-99,-99,-99,-99,6,13,187,770,3218,-1775546803,Asia,Southern Asia,Pakistan,Khyber-Pakhtunkhwa,Peshawar,Mashogagar Area,34.01,71.58,Pakistani Police patrol,3,22,128,Security,Police,Patrol,13,177,159,Domestic Government,Pakistani,N/A,18,49,21,N/A,N/A,N/A,0,0,0,40934540,1585107768,1585107768,Unknown Group,N/A,N/A,1585107768,1585107768,1585107768,N/A,N/A,N/A,1585107768,1585107768,1585107768,N/A,N/A,N/A,1,0,1,0
02-Oct-20,-2054068438,"2/14/2014: In Wushi, Xinjiang, China at Gate of a park, 3 attackers attacked Chinese Police patrol in a Confirmed Suicide suicide attack with a Car bomb, killing 4 people (2 civilian, 0 political, and 2 security) and wounding 4 people.  No group claimed responsibility.  (Note: Claim status not verified!) The attack was verified as Confirmed Suicide on 9/8/2014 1:13:29 PM. This summary generated: 10/9/2020 3:11:40 PM.",Confirmed Suicide,2,2/14/2014,2014,2,5,0,4,0,4,0,2,0,0,0,2,0,0,1,0,0,5,Car bomb,VBIED,None,-99,-99,-99,-99,-99,-99,-99,-99,6,12,49,710,1345,-1206253208,Asia,Eastern Asia,China,Xinjiang,Wushi,Gate of a park,41.213889,79.223056,Chinese Police patrol,3,22,128,Security,Police,Patrol,13,52,159,Domestic Government,Chinese,N/A,18,49,21,N/A,N/A,N/A,0,0,0,40934540,1585107768,1585107768,Unknown Group,N/A,N/A,1585107768,1585107768,1585107768,N/A,N/A,N/A,1585107768,1585107768,1585107768,N/A,N/A,N/A,3,0,0,3
02-Oct-20,-2053162774,"4/30/2013: In Tuz Khurmatu, Sala ad-Din, Iraq at Sulaiman Beg area, 1 attacker attacked Iraqi Police checkpoint in a Possible - Too Few Sources suicide attack with a Car bomb, killing no one (0 civilian, 0 political, and 0 security) and wounding 5 people.  No group claimed responsibility.  (Note: Claim status not verified!) The attack was verified as Possible - Too Few Sources on 7/18/2014 11:55:22 AM. This summary generated: 10/9/2020 3:11:40 PM.",Possible - Too Few Sources,1,4/30/2013,2013,4,2,5,5,0,0,0,0,0,0,0,0,0,0,1,0,0,5,Car bomb,VBIED,None,-99,-99,-99,-99,-99,-99,-99,-99,6,21,116,645,2325,-1229178376,Asia,Western Asia,Iraq,Sala ad-Din,Tuz Khurmatu,Sulaiman Beg area,34.88,44.63,Iraqi Police checkpoint,3,22,122,Security,Police,Checkpoint,13,111,159,Domestic Government,Iraqi,N/A,18,49,21,N/A,N/A,N/A,0,0,0,40934540,1585107768,1585107768,Unknown Group,N/A,N/A,1585107768,1585107768,1585107768,N/A,N/A,N/A,1585107768,1585107768,1585107768,N/A,N/A,N/A,1,0,0,1
02-Oct-20,-2052238418,"10/12/2006: In Khost, Khost, Afghanistan at Mujahid Square, Occurred minutes after attack on NATO Convoy, 1 attacker attacked Afghan National Army (ANA) military convoy in a Confirmed Suicide suicide attack with a Other PBIED, killing no one (0 civilian, 0 political, and 0 security) and wounding 9 people.  Taliban (IEA) claimed the attack.   The attack was verified as Confirmed Suicide on 4/14/2014 3:57:22 PM. This summary generated: 10/9/2020 3:11:40 PM.",Confirmed Suicide,3,10-12-2006,2006,10,4,9,9,0,0,0,0,0,0,0,0,0,0,0,1,0,16,Other PBIED,PBIED,None,333,-1,-99,-99,735,-1,-99,-99,6,13,1,700,5296,1796615793,Asia,Southern Asia,Afghanistan,Khost,Khost,"Mujahid Square, Occurred minutes after attack on NATO Convoy",33.34,69.9,Afghan National Army (ANA) military convoy,3,20,108,Security,Forces,Convoy,13,1,159,Domestic Government,Afghan,N/A,18,49,21,N/A,N/A,N/A,1,0,0,1088854842,1585107768,1585107768,Taliban (IEA),N/A,N/A,1585107768,1585107768,1585107768,N/A,N/A,N/A,1585107768,1585107768,1585107768,N/A,N/A,N/A,1,0,1,0
02-Oct-20,-2050675758,"4/15/2013: In Ad Dawr, Sala ad-Din, Iraq at NA, 1 attacker attacked Iraqi Police checkpoint in a Confirmed Suicide suicide attack with a Belt bomb, killing 2 people (0 civilian, 0 political, and 2 security) and wounding 13 people.  No group claimed responsibility.  (Note: Claim status not verified!) The attack was verified as Confirmed Suicide on 6/30/2014 11:32:04 AM. This summary generated: 10/9/2020 3:11:40 PM.",Confirmed Suicide,2,4/15/2013,2013,4,1,6,13,0,2,0,0,0,0,0,2,1,0,0,0,0,3,Belt bomb,PBIED,None,-99,-99,-99,-99,-99,-99,-99,-99,6,21,116,645,2325,-491192752,Asia,Western Asia,Iraq,Sala ad-Din,Ad Dawr,NA,34.4575,43.7983,Iraqi Police checkpoint,3,22,122,Security,Police,Checkpoint,13,111,159,Domestic Government,Iraqi,N/A,18,49,21,N/A,N/A,N/A,0,0,0,40934540,1585107768,1585107768,Unknown Group,N/A,N/A,1585107768,1585107768,1585107768,N/A,N/A,N/A,1585107768,1585107768,1585107768,N/A,N/A,N/A,1,0,0,1
02-Oct-20,-2050313057,"11/7/2017: In Maiduguri, Borno, Nigeria at Tomsu Ngamdu community, just outside Maiduguri, 2 attackers (2 of whom were female) attacked Farmers at work near/in Maiduguri in a Confirmed Suicide suicide attack with a Belt bomb, killing no one (0 civilian, 0 political, and 0 security) and wounding 8 people.  No group claimed responsibility, but Boko Haram (Shekau Faction) is suspected.  (Note: Claim status not verified!) The attack was verified as Confirmed Suicide on 1/22/2018 12:37:59 PM. This summary generated: 10/9/2020 3:11:40 PM.",Confirmed Suicide,2,11-07-2017,2017,11,2,6,8,0,0,0,0,0,0,0,0,1,0,0,0,0,3,Belt bomb,PBIED,None,297,-1,1850,-1,640,-1,2332,-1,3,4,181,475,2957,-1342462191,Africa,Western Africa,Nigeria,Borno,Maiduguri,"Tomsu Ngamdu community, just outside Maiduguri",11.833333,13.15,Farmers at work near/in Maiduguri,1,4,21,Civilian,General,Individual(s),42,165,144,N/A,Nigerian,Unknown,14,50,20,Unknown,Unknown,Unknown,0,0,1,40934540,1585107768,1585107768,Unknown Group,N/A,N/A,1585107768,1585107768,1585107768,N/A,N/A,N/A,2033412617,1585107768,1585107768,Boko Haram (Shekau Faction),N/A,N/A,2,2,0,0
02-Oct-20,-2049156956,"5/14/2010: In Tal Afar, Ninawa, Iraq at Stadium, Football Stadium in Tal Afar, 3 attackers attacked Football Stadium in a Confirmed Suicide suicide attack with a Belt bomb, killing 10 people (10 civilian, 0 political, and 0 security) and wounding 120 people.  No group claimed responsibility.  (Note: Claim status not verified!) The attack was verified as Confirmed Suicide on 8/7/2012. This summary generated: 10/9/2020 3:11:40 PM.",Confirmed Suicide,3,5/14/2010,2010,5,5,120,120,8,10,8,10,0,0,0,0,1,0,0,0,0,3,Belt bomb,PBIED,None,-99,-99,-99,-99,-99,-99,-99,-99,6,21,116,645,2322,556132980,Asia,Western Asia,Iraq,Ninawa,Tal Afar,"Stadium, Football Stadium in Tal Afar",36.374167,42.443333,Football Stadium,1,4,18,Civilian,General,Facility/Building,42,111,144,N/A,Iraqi,Unknown,6,2,23,Islam,Shia,Unknown (Shia),0,0,0,40934540,1585107768,1585107768,Unknown Group,N/A,N/A,1585107768,1585107768,1585107768,N/A,N/A,N/A,1585107768,1585107768,1585107768,N/A,N/A,N/A,3,0,0,3
02-Oct-20,-2048673828,"7/24/2008: In Baqubah, Diyala, Iraq at New Baquba area, Central Baquba, 1 attacker (1 of whom were female) attacked Sahwa/Awakening Council patrol in a Confirmed Suicide suicide attack with a Belt bomb, killing 8 people (0 civilian, 0 political, and 8 security) and wounding 24 people.  No group claimed responsibility.  (Note: Claim status not verified!) The attack was verified as Confirmed Suicide on 8/7/2012. This summary generated: 10/9/2020 3:11:40 PM.",Confirmed Suicide,3,7/24/2008,2008,7,4,20,24,8,8,0,0,0,0,8,8,1,0,0,0,0,3,Belt bomb,PBIED,None,-99,-99,-99,-99,-99,-99,-99,-99,6,21,116,645,2317,1290433160,Asia,Western Asia,Iraq,Diyala,Baqubah,"New Baquba area, Central Baquba",33.74,44.64,Sahwa/Awakening Council patrol,3,33,210,Security,Government Organized Militia,Patrol,2,111,13,Awakening,Iraqi,Arab,6,1,22,Islam,Sunni,Unknown (Sunni),0,0,0,40934540,1585107768,1585107768,Unknown Group,N/A,N/A,1585107768,1585107768,1585107768,N/A,N/A,N/A,1585107768,1585107768,1585107768,N/A,N/A,N/A,1,1,0,0
02-Oct-20,-2048642154,"9/1/2012: In Deir ez-Zor, Deir ez-Zor, Syria at N/A, 1 attacker attacked Unspecified in a Confirmed Suicide suicide attack with a Car bomb, killing 1 person (1 civilian, 0 political, and 0 security) and wounding 2 people.  No group claimed responsibility.  (Note: Claim status not verified!) The attack was verified as Confirmed Suicide on 8/29/2014 3:04:34 PM. This summary generated: 10/9/2020 3:11:40 PM.",Confirmed Suicide,2,09-01-2012,2012,9,6,2,2,1,1,1,1,0,0,0,0,0,0,1,0,0,5,Car bomb,VBIED,None,-99,-99,-99,-99,-99,-99,-99,-99,6,21,235,652,4017,1097750249,Asia,Western Asia,Syria,Deir ez-Zor,Deir ez-Zor,N/A,35.333333,40.15,Unspecified,1,4,27,Civilian,General,Residential Area,42,242,144,N/A,Unknown,Unknown,14,50,20,Unknown,Unknown,Unknown,0,0,0,40934540,1585107768,1585107768,Unknown Group,N/A,N/A,1585107768,1585107768,1585107768,N/A,N/A,N/A,1585107768,1585107768,1585107768,N/A,N/A,N/A,1,0,0,1
